{
  "schemaVersion": "1.0.0",
  "synthetic": true,
  "artifactId": "ART-18",
  "planSetId": "LABPLAN-2026-001",
  "parentCaseId": "CASE-2026-001",
  "relation": "refines",
  "decisionRequirementId": "DR-2026-001",
  "authorizationRecordId": "AUTH-CASE-2026-001",
  "parentThreatModelId": "TM-2026-001",
  "parentSignalMapId": "SFM-2026-001",
  "parentPrioritySetId": "VPR-2026-001",
  "scope": "read-only-synthetic-data",
  "modelVersion": "1.0.0",
  "executionMode": "offline-receipt-replay",
  "runtimeExecuted": false,
  "parentState": "No inherited observation, control, gap, priority or authorization is promoted.",
  "legalBoundary": "Educational reproducibility only; not legal admissibility or production assurance.",
  "states": [
    "Planned",
    "Preflight passed",
    "Ready",
    "Running",
    "Stopped",
    "Destroyed",
    "Cleanup verified",
    "Failed closed"
  ],
  "architecture": {
    "platformModel": "WSL2 and rootless Podman equivalent abstract design",
    "runtimeVersion": "not-executed",
    "imageDigest": null,
    "rootless": true,
    "privileged": false,
    "capabilities": [],
    "hostNetwork": false,
    "egressPolicy": "default-deny",
    "allowedEndpointClass": "reserved-synthetic-only",
    "networkId": "NET-LAB08-001",
    "exampleHost": "lab.test",
    "exampleAddress": "192.0.2.8",
    "exposure": "local-only-design-not-opened",
    "inputMode": "read-only",
    "outputMode": "ephemeral-design-not-allocated",
    "mountScope": "dedicated-lab-directory-only",
    "credentialMaterial": "none",
    "classification": "synthetic-only",
    "limits": "bounded-cpu-memory-disk-time-model; no actual runtime measurement"
  },
  "runs": [
    {
      "runId": "RUN-LAB08-SAFE",
      "synthetic": true,
      "planId": "LABPLAN-08-001",
      "labId": "LAB-08-001",
      "objective": "合成記録だけで開始条件・停止・残存確認を判断する。",
      "scope": "read-only-synthetic-data",
      "signalFlowId": "SF-2026-001",
      "priorityRecordId": "VPR-ITEM-005",
      "assetIds": [
        "ASSET-2026-002",
        "ASSET-2026-005"
      ],
      "boundaryIds": [
        "TB-2026-001",
        "TB-2026-003"
      ],
      "parentCoverage": "Produced",
      "parentGapId": "GAP-SF-001",
      "startsAt": "2026-09-13T00:00:00Z",
      "endsAt": "2026-09-13T00:01:00Z",
      "receiptIds": [
        "RCP-LAB08-001-001",
        "RCP-LAB08-001-002",
        "RCP-LAB08-001-003",
        "RCP-LAB08-001-004",
        "RCP-LAB08-001-005",
        "RCP-LAB08-001-006",
        "RCP-LAB08-001-007",
        "RCP-LAB08-001-008",
        "RCP-LAB08-001-009",
        "RCP-LAB08-001-010",
        "RCP-LAB08-001-011",
        "RCP-LAB08-001-012",
        "RCP-LAB08-001-013",
        "RCP-LAB08-001-014",
        "RCP-LAB08-001-015",
        "RCP-LAB08-001-016",
        "RCP-LAB08-001-017",
        "RCP-LAB08-001-018",
        "RCP-LAB08-001-019",
        "RCP-LAB08-001-020",
        "RCP-LAB08-001-021",
        "RCP-LAB08-001-022",
        "RCP-LAB08-001-023",
        "RCP-LAB08-001-024"
      ],
      "signalIds": [
        "EVENT-LAB08-001-001",
        "EVENT-LAB08-001-002",
        "EVENT-LAB08-001-003"
      ],
      "evidenceArtifactId": "EVD-LAB08-001",
      "stopId": "STOP-LAB08-001",
      "cleanupId": "CLEAN-LAB08-001",
      "reassessmentId": "REASSESS-LAB08-001",
      "owner": "SYNTH-LAB-OWNER",
      "reviewer": "SYNTH-LAB-REVIEWER",
      "expectedEvidence": "合成control receiptsとOAuth/API/Telemetry教材の一致。",
      "prohibitedEvidence": "実Credential・実Token・実Cookie・個人情報は収集しない。",
      "stopCondition": "FailまたはUnknownなら新規シナリオ操作を停止し、状態とEvidenceを保存する。",
      "rollback": "合成資源台帳の停止・Evidence export・破棄・六種残存検査を順に照合する。",
      "evidenceRetention": "EVD-LAB08-001は教材正本として保持し、削除対象の一時資源とは区別する。",
      "gap": "実Runtimeの隔離・停止・残存は未測定。親のGapは不変。",
      "confidence": "低",
      "alternative": "供給された合成receiptが実環境で成立するとは限らない。",
      "reassessmentTrigger": "新Run ID、Authority、境界、実装版、時計、収集状態、残存結果の変更。",
      "nextReviewDate": "2026-09-14",
      "expected": {
        "verdict": "Safe",
        "statusHistory": [
          "Planned",
          "Preflight passed",
          "Ready",
          "Running",
          "Stopped",
          "Destroyed",
          "Cleanup verified"
        ],
        "finalStatus": "Cleanup verified",
        "completedNormally": true,
        "cleanupVerified": true,
        "executionAuthorized": false,
        "failureReceiptIds": [],
        "unknownReceiptIds": [],
        "skippedStages": []
      },
      "roeReference": "not-issued; S0/S1 read-only lesson, no operational RoE",
      "emergencyContact": "SYNTH-LAB-OWNER",
      "executionStepId": "STEP-LAB08-001-REPLAY"
    },
    {
      "runId": "RUN-LAB08-UNSAFE",
      "synthetic": true,
      "planId": "LABPLAN-08-002",
      "labId": "LAB-08-002",
      "objective": "合成記録だけで開始条件・停止・残存確認を判断する。",
      "scope": "read-only-synthetic-data",
      "signalFlowId": "SF-2026-001",
      "priorityRecordId": "VPR-ITEM-005",
      "assetIds": [
        "ASSET-2026-002",
        "ASSET-2026-005"
      ],
      "boundaryIds": [
        "TB-2026-001",
        "TB-2026-003"
      ],
      "parentCoverage": "Produced",
      "parentGapId": "GAP-SF-001",
      "startsAt": "2026-09-13T00:02:00Z",
      "endsAt": "2026-09-13T00:03:00Z",
      "receiptIds": [
        "RCP-LAB08-002-001",
        "RCP-LAB08-002-002",
        "RCP-LAB08-002-003",
        "RCP-LAB08-002-004",
        "RCP-LAB08-002-005",
        "RCP-LAB08-002-006",
        "RCP-LAB08-002-007",
        "RCP-LAB08-002-008",
        "RCP-LAB08-002-009",
        "RCP-LAB08-002-010",
        "RCP-LAB08-002-011",
        "RCP-LAB08-002-012",
        "RCP-LAB08-002-013",
        "RCP-LAB08-002-014",
        "RCP-LAB08-002-015",
        "RCP-LAB08-002-016",
        "RCP-LAB08-002-017",
        "RCP-LAB08-002-018",
        "RCP-LAB08-002-019",
        "RCP-LAB08-002-020",
        "RCP-LAB08-002-021",
        "RCP-LAB08-002-022",
        "RCP-LAB08-002-023",
        "RCP-LAB08-002-024"
      ],
      "signalIds": [
        "EVENT-LAB08-002-001",
        "EVENT-LAB08-002-002",
        "EVENT-LAB08-002-003"
      ],
      "evidenceArtifactId": "EVD-LAB08-001",
      "stopId": "STOP-LAB08-002",
      "cleanupId": "CLEAN-LAB08-002",
      "reassessmentId": "REASSESS-LAB08-002",
      "owner": "SYNTH-LAB-OWNER",
      "reviewer": "SYNTH-LAB-REVIEWER",
      "expectedEvidence": "合成control receiptsとOAuth/API/Telemetry教材の一致。",
      "prohibitedEvidence": "実Credential・実Token・実Cookie・個人情報は収集しない。",
      "stopCondition": "FailまたはUnknownなら新規シナリオ操作を停止し、状態とEvidenceを保存する。",
      "rollback": "合成資源台帳の停止・Evidence export・破棄・六種残存検査を順に照合する。",
      "evidenceRetention": "EVD-LAB08-001は教材正本として保持し、削除対象の一時資源とは区別する。",
      "gap": "実Runtimeの隔離・停止・残存は未測定。親のGapは不変。",
      "confidence": "低",
      "alternative": "供給された合成receiptが実環境で成立するとは限らない。",
      "reassessmentTrigger": "新Run ID、Authority、境界、実装版、時計、収集状態、残存結果の変更。",
      "nextReviewDate": "2026-09-14",
      "expected": {
        "verdict": "Unsafe",
        "statusHistory": [
          "Planned",
          "Preflight passed",
          "Ready",
          "Running",
          "Failed closed",
          "Stopped",
          "Destroyed",
          "Cleanup verified"
        ],
        "finalStatus": "Cleanup verified",
        "completedNormally": false,
        "cleanupVerified": true,
        "executionAuthorized": false,
        "failureReceiptIds": [
          "RCP-LAB08-002-009"
        ],
        "unknownReceiptIds": [],
        "skippedStages": []
      },
      "roeReference": "not-issued; S0/S1 read-only lesson, no operational RoE",
      "emergencyContact": "SYNTH-LAB-OWNER",
      "executionStepId": "STEP-LAB08-002-REPLAY"
    },
    {
      "runId": "RUN-LAB08-INCONCLUSIVE",
      "synthetic": true,
      "planId": "LABPLAN-08-003",
      "labId": "LAB-08-003",
      "objective": "合成記録だけで開始条件・停止・残存確認を判断する。",
      "scope": "read-only-synthetic-data",
      "signalFlowId": "SF-2026-001",
      "priorityRecordId": "VPR-ITEM-005",
      "assetIds": [
        "ASSET-2026-002",
        "ASSET-2026-005"
      ],
      "boundaryIds": [
        "TB-2026-001",
        "TB-2026-003"
      ],
      "parentCoverage": "Produced",
      "parentGapId": "GAP-SF-001",
      "startsAt": "2026-09-13T00:04:00Z",
      "endsAt": "2026-09-13T00:05:00Z",
      "receiptIds": [
        "RCP-LAB08-003-001",
        "RCP-LAB08-003-002",
        "RCP-LAB08-003-003",
        "RCP-LAB08-003-004",
        "RCP-LAB08-003-005",
        "RCP-LAB08-003-006",
        "RCP-LAB08-003-007",
        "RCP-LAB08-003-008",
        "RCP-LAB08-003-009",
        "RCP-LAB08-003-010",
        "RCP-LAB08-003-011",
        "RCP-LAB08-003-012",
        "RCP-LAB08-003-013",
        "RCP-LAB08-003-014",
        "RCP-LAB08-003-015",
        "RCP-LAB08-003-016",
        "RCP-LAB08-003-017",
        "RCP-LAB08-003-018",
        "RCP-LAB08-003-019",
        "RCP-LAB08-003-020",
        "RCP-LAB08-003-021",
        "RCP-LAB08-003-022",
        "RCP-LAB08-003-023",
        "RCP-LAB08-003-024"
      ],
      "signalIds": [
        "EVENT-LAB08-003-001",
        "EVENT-LAB08-003-002",
        "EVENT-LAB08-003-003"
      ],
      "evidenceArtifactId": "EVD-LAB08-001",
      "stopId": "STOP-LAB08-003",
      "cleanupId": "CLEAN-LAB08-003",
      "reassessmentId": "REASSESS-LAB08-003",
      "owner": "SYNTH-LAB-OWNER",
      "reviewer": "SYNTH-LAB-REVIEWER",
      "expectedEvidence": "合成control receiptsとOAuth/API/Telemetry教材の一致。",
      "prohibitedEvidence": "実Credential・実Token・実Cookie・個人情報は収集しない。",
      "stopCondition": "FailまたはUnknownなら新規シナリオ操作を停止し、状態とEvidenceを保存する。",
      "rollback": "合成資源台帳の停止・Evidence export・破棄・六種残存検査を順に照合する。",
      "evidenceRetention": "EVD-LAB08-001は教材正本として保持し、削除対象の一時資源とは区別する。",
      "gap": "実Runtimeの隔離・停止・残存は未測定。親のGapは不変。",
      "confidence": "低",
      "alternative": "供給された合成receiptが実環境で成立するとは限らない。",
      "reassessmentTrigger": "新Run ID、Authority、境界、実装版、時計、収集状態、残存結果の変更。",
      "nextReviewDate": "2026-09-14",